{"apiVersion":"flex.dev/v1alpha1","deployments":[{"apiVersion":"application.margo.org/v1alpha1","kind":"ApplicationDeployment","metadata":{"deviceId":"vec-dev","id":"native-app","name":"native-app","namespace":"default"},"spec":{"applicationId":"vec_native","deploymentProfile":{"components":[{"name":"vec_native","properties":{"digest":"sha256:90c94f4c59d1ca5c1bfe7b23a36752336265c40e61418cfacaaa01ed3e5db466","repository":"oci://registry.vec.invalid/flexnodes/vec_native","revision":"1.0.0","size":949}}],"type":"custom"},"parameters":{}},"x-flex-activation":{"requires":["machine_parked"]},"x-flex-driver":"native","x-flex-safetyClass":"none"},{"apiVersion":"application.margo.org/v1alpha1","kind":"ApplicationDeployment","metadata":{"deviceId":"vec-dev","id":"safety-app","name":"safety-app","namespace":"default"},"spec":{"applicationId":"vec_safety","deploymentProfile":{"components":[{"name":"vec_safety","properties":{"digest":"sha256:64ef6f194369739b68f7c20ce3ab817a836835e8c246e358b5ba95e18a30ea11","repository":"oci://registry.vec.invalid/flexnodes/vec_safety","revision":"1.0.0","size":960}}],"type":"custom"},"parameters":{}},"x-flex-driver":"native","x-flex-safetyClass":"safety-relevant"}],"deviceId":"vec-dev","kind":"DesiredState","manifestVersion":3}